No,Category,Type,Question,Revised,Disclaimer,Combined_Content
1,General,What's New,What's new and different about <Galaxy S23 Series > ? ,"Would you like to hear about Samsung’s latest Galaxy S23 Series and its amazing Nightography?
Let me tell you how you can capture bright, clear pictures and videos at night!

The S23's camera comes with enhanced Nightography! With a new 12 MP front camera and new AI features, your night selfies will have more authentic colors and details along with stunning night portraits. Video recording at night is more stable and also much sharper with less noise than before.

The latest 4nm processor has become more powerful, and the intelligent display is the brightest in the Galaxy Series and it offers a smoother, brighter, and more comfortable viewing experience with adaptive Vision Booster*. Its worry-free battery makes the usage time much longer.

The S23 Ultra comes with our Signature S Pen built in with our Ultra model.

With 3 models to choose from, along with amazing promotions and programs. 
We can help find the Galaxy S23 Series that is perfect for you.",*Not activated when Eye comfort shield is active.,"Revised : 
Would you like to hear about Samsung’s latest Galaxy S23 Series and its amazing Nightography?
Let me tell you how you can capture bright, clear pictures and videos at night!

The S23's camera comes with enhanced Nightography! With a new 12 MP front camera and new AI features, your night selfies will have more authentic colors and details along with stunning night portraits. Video recording at night is more stable and also much sharper with less noise than before.

The latest 4nm processor has become more powerful, and the intelligent display is the brightest in the Galaxy Series and it offers a smoother, brighter, and more comfortable viewing experience with adaptive Vision Booster*. Its worry-free battery makes the usage time much longer.

The S23 Ultra comes with our Signature S Pen built in with our Ultra model.

With 3 models to choose from, along with amazing promotions and programs. 
We can help find the Galaxy S23 Series that is perfect for you. 

Disclaimer : 
*Not activated when Eye comfort shield is active."
2,Design,Color,What kind of colors are available for <Galaxy S23 Series>?,"Galaxy S23 Series comes in a variety of premium colors inspired by nature.

It comes in 4 colors: Phantom Black, Cream, Green, and Lavender. 
For exclusive S.com colors, 4 trendy options — Lime, Sky Blue, Graphite, and Red, are also available. 

What color interests you the most?",*Color availability may vary depending on country or carrier.,"Revised : 
Galaxy S23 Series comes in a variety of premium colors inspired by nature.

It comes in 4 colors: Phantom Black, Cream, Green, and Lavender. 
For exclusive S.com colors, 4 trendy options — Lime, Sky Blue, Graphite, and Red, are also available. 

What color interests you the most? 

Disclaimer : 
*Color availability may vary depending on country or carrier."
3,Design,Design,What are the key design elements/improvement of <Galaxy S23 Series>?  ,"Thank you for asking, <Customer Name>. 

The S23 Series features a complete Galaxy design identity by adopting the floating camera shape to visualize a high-performing photo and video. And it is partially made with various recycled materials, from a plastic to metal to achieve a more eco-conscious design and to achieve our goal, ""Galaxy for the Planet."" It comes with four premium colors inspired by nature—Phantom Black, Cream, Green, and Lavender, where the PET film used to express colors are also made with a recycled material. And the S23 Ultra readjusted curvature of the display edge for larger flat area to enhance S Pen productivity. 

Each model has Corning® Gorilla® Glass Victus® 2, which is stronger than the previous model. The toughest Armor Aluminum is also applied to the frame for maximum durability.

Take a closer look at the authentic look of the signature Galaxy design.",,"Revised : 
Thank you for asking, <Customer Name>. 

The S23 Series features a complete Galaxy design identity by adopting the floating camera shape to visualize a high-performing photo and video. And it is partially made with various recycled materials, from a plastic to metal to achieve a more eco-conscious design and to achieve our goal, ""Galaxy for the Planet."" It comes with four premium colors inspired by nature—Phantom Black, Cream, Green, and Lavender, where the PET film used to express colors are also made with a recycled material. And the S23 Ultra readjusted curvature of the display edge for larger flat area to enhance S Pen productivity. 

Each model has Corning® Gorilla® Glass Victus® 2, which is stronger than the previous model. The toughest Armor Aluminum is also applied to the frame for maximum durability.

Take a closer look at the authentic look of the signature Galaxy design."
4,Design,Color,Why <Color> is not available in our country?,"Unfortunately, that particular color option is not available within this region. However, we do have a variety of other colors to choose from….such as….(list available colors) ",*Color availability may vary depending on country or carrier.,"Revised : 
Unfortunately, that particular color option is not available within this region. However, we do have a variety of other colors to choose from….such as….(list available colors)  

Disclaimer : 
*Color availability may vary depending on country or carrier."
5,Design,Color,Are there any exclusive color options when purchasing from S.com?,"Thanks for asking. The exclusive colors you could purchase from S.com are...

Global - Phantom Black, Cream, Green, Lavender
Online - Lime, Sky Blue, Graphite, Red

Not in a participating country: Unfortunately, The Samung.com Exclusive Colorway option is not available within this region. However, we do have a variety of other colors to choose from…. such as…. (list available colors)   ","*Service availability may vary depending on country or carrier.
","Revised : 
Thanks for asking. The exclusive colors you could purchase from S.com are...

Global - Phantom Black, Cream, Green, Lavender
Online - Lime, Sky Blue, Graphite, Red

Not in a participating country: Unfortunately, The Samung.com Exclusive Colorway option is not available within this region. However, we do have a variety of other colors to choose from…. such as…. (list available colors)    

Disclaimer : 
*Service availability may vary depending on country or carrier.
"
6,Design,Materials,What materials are used for <Galaxy S23 Series>?,"That is a great question, <Customer's name>!

The S23 Series has adopted various recycled materials to make its design more eco-conscious. Discarded fishing nets, glass, aluminum, and PET bottles are recycled through Samsung's technologies, and they are partially applied to the S23 Series for a more eco-friendly design.

It newly features tougher Corning® Gorilla® Glass Victus® 2 on the front and back of the device. Additionally, the frame is crafted with Armor Aluminum for increased durability, while still maintaining a premium design.",,"Revised : 
That is a great question, <Customer's name>!

The S23 Series has adopted various recycled materials to make its design more eco-conscious. Discarded fishing nets, glass, aluminum, and PET bottles are recycled through Samsung's technologies, and they are partially applied to the S23 Series for a more eco-friendly design.

It newly features tougher Corning® Gorilla® Glass Victus® 2 on the front and back of the device. Additionally, the frame is crafted with Armor Aluminum for increased durability, while still maintaining a premium design."
7,Design,UX,What is the UX improvement? ,"Thank you for your inquiry, <Customer's name>!'

A new One UI 5 is developed while focusing on a better personal experience. Its user-friendly UX has become more customizable, productive, and secure with updated visuals and interactions. And it's easier to learn how to use the S23 Series, even if you’re a beginner. 

There are 3 key improvements of the new One UI 5, would you like to hear about them? (If yes, then proceed.)

•	 Customization: Its lock screen and home screen are now more customizable. You can set a video to the lock screen after easily editing. And now it supports stacking widgets on the home screen by simply dragging each widget to the area you want. More diverse, customizable emojis and stickers are available in your own style, and Routine mode can be customizable, in addition to 5 presets. 

• 	Productivity: Enjoy another level of video calling. By collaborating with Google Meet, the resolution of video calls has increased from 540p (Google Duo) to 720p, and noise is minimized during calls. Also, it now supports co-editing on Samsung Notes during group video calls. Enhanced Link to Windows lets you continuously enjoy browsing websites from your phone on your PC and play music either on your phone or PC. Also, you can now control your PC, tablet, and your phone with just one mouse/keyboard. Plus, Expert RAW images and high-resolution videos from your phone can be automatically shared with your PC.*

• 	Privacy & Security: With One UI 5, it is easier and more intuitive to check the status of your device, and it suggests users to use Private Share when photos with personal info are shared.**","* Expert RAW app > Settings > Auto share to PC or tablet (on/off)
** Only active when the default language is Korean/English (US)","Revised : 
Thank you for your inquiry, <Customer's name>!'

A new One UI 5 is developed while focusing on a better personal experience. Its user-friendly UX has become more customizable, productive, and secure with updated visuals and interactions. And it's easier to learn how to use the S23 Series, even if you’re a beginner. 

There are 3 key improvements of the new One UI 5, would you like to hear about them? (If yes, then proceed.)

•	 Customization: Its lock screen and home screen are now more customizable. You can set a video to the lock screen after easily editing. And now it supports stacking widgets on the home screen by simply dragging each widget to the area you want. More diverse, customizable emojis and stickers are available in your own style, and Routine mode can be customizable, in addition to 5 presets. 

• 	Productivity: Enjoy another level of video calling. By collaborating with Google Meet, the resolution of video calls has increased from 540p (Google Duo) to 720p, and noise is minimized during calls. Also, it now supports co-editing on Samsung Notes during group video calls. Enhanced Link to Windows lets you continuously enjoy browsing websites from your phone on your PC and play music either on your phone or PC. Also, you can now control your PC, tablet, and your phone with just one mouse/keyboard. Plus, Expert RAW images and high-resolution videos from your phone can be automatically shared with your PC.*

• 	Privacy & Security: With One UI 5, it is easier and more intuitive to check the status of your device, and it suggests users to use Private Share when photos with personal info are shared.** 

Disclaimer : 
* Expert RAW app > Settings > Auto share to PC or tablet (on/off)
** Only active when the default language is Korean/English (US)"
8,Camera,Technology,Is there any industry-leading technology adopted for <S23 Series> camera?,"That's a really good question, <Customer Name>. 
Galaxy S23 Series is the king of Nightography! 

[Selfie]
It features a new 12 MP front camera with Dual Pixel AF for faster, more precise focusing. With its AI Object-aware Engine, the 12MP camera captures night selfies with more realistic colors and finer details. Thanks to the Dual Pixel AF and AI Stereo Depth, the S23's night selfie portraits can get more stunning bokeh effects.

[Video]
Galaxy S23 Series sports tack sharp videos where you could experience enhanced sharpness with reduced noise. And its Adaptive VDIS makes your night action videos more stable with less blur. For the S23 Ultra, it has 2x wider 3° OIS than the S22 Ultra for more powerful stabilization.

[High-resolution]
Enhanced Super HDR provides a 4x wider dynamic range in which more details in both the dark and bright areas are shown especially for backlit photos. Detail Enhancer which adds extra details using AI is now applied by default. For S23 Ultra's 200MP, it delivers spectacular details even when cropped or reframed. Also, Pro mode and Expert RAW app now supports 50MP resolution and an option to use the front camera.","
*compared with S21 Series
","Revised : 
That's a really good question, <Customer Name>. 
Galaxy S23 Series is the king of Nightography! 

[Selfie]
It features a new 12 MP front camera with Dual Pixel AF for faster, more precise focusing. With its AI Object-aware Engine, the 12MP camera captures night selfies with more realistic colors and finer details. Thanks to the Dual Pixel AF and AI Stereo Depth, the S23's night selfie portraits can get more stunning bokeh effects.

[Video]
Galaxy S23 Series sports tack sharp videos where you could experience enhanced sharpness with reduced noise. And its Adaptive VDIS makes your night action videos more stable with less blur. For the S23 Ultra, it has 2x wider 3° OIS than the S22 Ultra for more powerful stabilization.

[High-resolution]
Enhanced Super HDR provides a 4x wider dynamic range in which more details in both the dark and bright areas are shown especially for backlit photos. Detail Enhancer which adds extra details using AI is now applied by default. For S23 Ultra's 200MP, it delivers spectacular details even when cropped or reframed. Also, Pro mode and Expert RAW app now supports 50MP resolution and an option to use the front camera. 

Disclaimer : 

*compared with S21 Series
"
9,Camera,Space Zoom,Does Galaxy S23 Series provide Space Zoom as well?,"Yes Indeed. You can capture high quality zoom shots with every model. 

•	S23 Ultra: 3/10X optical zoom, 100x Space Zoom
•	S23/S23+: 3x optical zoom, 30x digital zoom",,"Revised : 
Yes Indeed. You can capture high quality zoom shots with every model. 

•	S23 Ultra: 3/10X optical zoom, 100x Space Zoom
•	S23/S23+: 3x optical zoom, 30x digital zoom"
10,Camera,Single Take,What is 'Single Take' in Camera mode ?,"Great question <Customer Name>! 

Single Take is a whole new way to capture the moment. 

When using Single Take, simply tap the shutter once and move around to capture the environment around you from different angles. Single take automatically captures photos and videos in a variety of styles, angles, and formats",,"Revised : 
Great question <Customer Name>! 

Single Take is a whole new way to capture the moment. 

When using Single Take, simply tap the shutter once and move around to capture the environment around you from different angles. Single take automatically captures photos and videos in a variety of styles, angles, and formats"
11,Camera,Portrait mode,What are the advanced features of <Portrait Selfie>? ,"With the new 12 MP Dual Pixel AF front camera and AI Stereo Depth feature, the S23 Series captures delicate night selfie portraits.

The Dual Pixel AF lets the S23 Series focus on subjects more quickly and precisely, even at night.
And the AI Stereo Depth provides stunning bokeh with delicate, clear segmentation for more impressive selfie portraits.",,"Revised : 
With the new 12 MP Dual Pixel AF front camera and AI Stereo Depth feature, the S23 Series captures delicate night selfie portraits.

The Dual Pixel AF lets the S23 Series focus on subjects more quickly and precisely, even at night.
And the AI Stereo Depth provides stunning bokeh with delicate, clear segmentation for more impressive selfie portraits."
12,Camera,Director's view,What is <Director's View>?,"Director's View is a new way to record videos using the three rear cameras (Ultra Wide/Wide/Tele 3x) within the same video. 

While recording you can see a preview of each camera. Simply tap on the preview to change the camera angle, giving you a professional touch. And now with the S23 Series, Adaptive VDIS supported Director's view for even more stable video recording.",,"Revised : 
Director's View is a new way to record videos using the three rear cameras (Ultra Wide/Wide/Tele 3x) within the same video. 

While recording you can see a preview of each camera. Simply tap on the preview to change the camera angle, giving you a professional touch. And now with the S23 Series, Adaptive VDIS supported Director's view for even more stable video recording."
13,Camera,Video,What are the enhancements for Video quality ?What is the  'Super Steady System' ?,"The S23 Series has the fastest 4nm processor ever in a Galaxy, and it's responsible for its ultimate video performance with Super Steady System. Its Adaptive VDIS powered by its 4nm processor lets you take more stable dynamic action videos with less blur in scenarios with various movements/brightness. And for the S23 Ultra, 2x wider ±3° OIS* give an additional stabilization.","* Compared with the S22 Series. 
* S23 Ultra only.","Revised : 
The S23 Series has the fastest 4nm processor ever in a Galaxy, and it's responsible for its ultimate video performance with Super Steady System. Its Adaptive VDIS powered by its 4nm processor lets you take more stable dynamic action videos with less blur in scenarios with various movements/brightness. And for the S23 Ultra, 2x wider ±3° OIS* give an additional stabilization. 

Disclaimer : 
* Compared with the S22 Series. 
* S23 Ultra only."
14,Camera,Laser AF,Why isn’t there Depth Camera?,"With the S23 Series’ powerful AI technology based on its 4nm processor, you can enjoy a variety of great camera features.

Compared to a ToF (time of flight) sensor, the S23 Ultra comes equipped with a Laser AF that performs higher with auto focusing every shot, including close-up macro shots.",,"Revised : 
With the S23 Series’ powerful AI technology based on its 4nm processor, you can enjoy a variety of great camera features.

Compared to a ToF (time of flight) sensor, the S23 Ultra comes equipped with a Laser AF that performs higher with auto focusing every shot, including close-up macro shots."
15,Camera,Auto Framing,Is there any difference with auto framing compared to the Foldable models?,"Like the S22 Series, the S23 Series recognizes up to 10 people at a recognizable distance of 5 meters.
It also supports single person tracking framing by touching and selecting a human on the screen and it automatically frames the subject.",,"Revised : 
Like the S22 Series, the S23 Series recognizes up to 10 people at a recognizable distance of 5 meters.
It also supports single person tracking framing by touching and selecting a human on the screen and it automatically frames the subject."
16,Camera,Pro / Pro Video,What improvements have been made in the Pro/Pro Video Mode?,"That is a great question <Customer's Name>!

Now, the S23 Series in Pro/Pro Video mode supports the front camera for using in more various shooting situations. (S22 Series: Only rear lenses supported)*

Also, 50 MP shooting is newly supported in Pro mode to get higher-resolution photos.**
So, you can enjoy a more DSLR-like shooting experience by adjusting the shutter speed, ISO, WB, and more while recording with more various lens angles.","* For the S22 Series, only rear lenses supported.
** For the S22 Series' wide camera, only 12MP shooting supported.","Revised : 
That is a great question <Customer's Name>!

Now, the S23 Series in Pro/Pro Video mode supports the front camera for using in more various shooting situations. (S22 Series: Only rear lenses supported)*

Also, 50 MP shooting is newly supported in Pro mode to get higher-resolution photos.**
So, you can enjoy a more DSLR-like shooting experience by adjusting the shutter speed, ISO, WB, and more while recording with more various lens angles. 

Disclaimer : 
* For the S22 Series, only rear lenses supported.
** For the S22 Series' wide camera, only 12MP shooting supported."
17,Camera,Google Duo,Any differentiation for Google duo service for galaxy users?,"Google DUO is now merged with Google Meet, and through our strong partnership with Google, we now have Google Meet’s exclusive features on the Galaxy.

It supports 720p high-resolution group video calls, and for the first time, when on a Google Meet group call, you could co-edit Samsung Notes with call participants in real time!",,"Revised : 
Google DUO is now merged with Google Meet, and through our strong partnership with Google, we now have Google Meet’s exclusive features on the Galaxy.

It supports 720p high-resolution group video calls, and for the first time, when on a Google Meet group call, you could co-edit Samsung Notes with call participants in real time!"
18,Performance,AP / Memory / storage,"How is the AP, Memory and storage of <Galaxy S23 Series>?","Each Galaxy S23 Series models is powered by a new 4nm processor. This is the fastest ever in a Galaxy Series. 

The S23 Series ships with the latest Qualcomm® Snapdragon 8 Gen 2 for Galaxy. 
The Snapdragon processors go through the same strict and rigorous, real-life testing scenarios in order to deliver a consistent, optimal performance over the entire lifespan of the device.

Also, the S23 Series comes with large Memory size (8/12 GB) engineered with LPDDR5 for more swift multitasking and tasks.  
•	 S23 Ultra: Memory (8/12 GB), Storage (256/512 GB, 1 TB)
•	 S23+: Memory (8 GB), Storage (256/512 GB)
• S23: Memory (8 GB), Storage (128/256/512 GB)","* Compared to prior generation chipset. Actual performance may vary depending on testing conditions.
※ Memory and storage options may vary by countries. 
※ Actual internal storage available may vary depending on pre-installed software. ","Revised : 
Each Galaxy S23 Series models is powered by a new 4nm processor. This is the fastest ever in a Galaxy Series. 

The S23 Series ships with the latest Qualcomm® Snapdragon 8 Gen 2 for Galaxy. 
The Snapdragon processors go through the same strict and rigorous, real-life testing scenarios in order to deliver a consistent, optimal performance over the entire lifespan of the device.

Also, the S23 Series comes with large Memory size (8/12 GB) engineered with LPDDR5 for more swift multitasking and tasks.  
•	 S23 Ultra: Memory (8/12 GB), Storage (256/512 GB, 1 TB)
•	 S23+: Memory (8 GB), Storage (256/512 GB)
• S23: Memory (8 GB), Storage (128/256/512 GB) 

Disclaimer : 
* Compared to prior generation chipset. Actual performance may vary depending on testing conditions.
※ Memory and storage options may vary by countries. 
※ Actual internal storage available may vary depending on pre-installed software. "
19,Performance,Wi-Fi,How much faster is the <Wi-Fi 6E> than Wi-Fi6?,"Thank you for asking <Customer Name>.

'Wi-Fi 6E' supports a maximum speed of 2.4Gbps, making it 2x faster than the previous Wi-Fi 6’s 1.2Gbps. ",※ Wi-Fi 6E: Only supports S23 Ultra/S23+ (S23 is Wi-Fi6),"Revised : 
Thank you for asking <Customer Name>.

'Wi-Fi 6E' supports a maximum speed of 2.4Gbps, making it 2x faster than the previous Wi-Fi 6’s 1.2Gbps.  

Disclaimer : 
※ Wi-Fi 6E: Only supports S23 Ultra/S23+ (S23 is Wi-Fi6)"
20,Performance,UWB,What is UWB(Ultra-wideband) technology and how can I use it ?  ,"UWB stands for Ultra-Wide Band, which is a next generation wireless communication technology with high accuracy and enhanced security

For example: If you want to share a file with someone you can simply point your smartphone at another person's device, then the user can instantly share files. *

In their near future, UWB technology could potentially be used as a digital key to unlock your car or front door rather than carrying multiple keys. 

※ S23+ and S23 Ultra support UWB technology ONLY.",* Both sending and receiving devices must support UWB.,"Revised : 
UWB stands for Ultra-Wide Band, which is a next generation wireless communication technology with high accuracy and enhanced security

For example: If you want to share a file with someone you can simply point your smartphone at another person's device, then the user can instantly share files. *

In their near future, UWB technology could potentially be used as a digital key to unlock your car or front door rather than carrying multiple keys. 

※ S23+ and S23 Ultra support UWB technology ONLY. 

Disclaimer : 
* Both sending and receiving devices must support UWB."
