No,Category,Type,Question,Revised,Disclaimer,Combined_Content
21,Performance,Micro SD,Does the Galaxy S23 Series support microSD cards for storage expansion? Why did Samsung remove the SD card slot from S23 Series?,"Thank you for asking, <Customer Name>. '

The Galaxy S23 Series does not support a microSD card, but it does offer several storage options so you don't have to worry about running out of storage. 

[Storage]
- S23 Ultra: 256/512 GB/1 TB  
- S23+: 256/512 GB   
- S23: 128/256/512 GB

The S23+/S23 Ultra offers 2x more storage for basic models compared to the S22+/S22 Ultra. (S22+/S22 Ultra: 128 GB → S23+/S23 Ultra: 256GB)*
So, you can choose the best storage option for you so that you have enough storage for years of old photos, videos, messages, and other files from your previous phone and for the future. ",* S23 starts at 128 GB storage for the basic model.,"Revised : 
Thank you for asking, <Customer Name>. '

The Galaxy S23 Series does not support a microSD card, but it does offer several storage options so you don't have to worry about running out of storage. 

[Storage]
- S23 Ultra: 256/512 GB/1 TB  
- S23+: 256/512 GB   
- S23: 128/256/512 GB

The S23+/S23 Ultra offers 2x more storage for basic models compared to the S22+/S22 Ultra. (S22+/S22 Ultra: 128 GB → S23+/S23 Ultra: 256GB)*
So, you can choose the best storage option for you so that you have enough storage for years of old photos, videos, messages, and other files from your previous phone and for the future.  

Disclaimer : 
* S23 starts at 128 GB storage for the basic model."
22,Performance,Game,How's the gaming performance?,"That's a wonderful question, <Customer Name>!

The Galaxy S23 Series is definitely the Ultimate Gaming Machine. 

With the fastest 4nm AP in Galaxy ever, the S23 Series provides powerful gaming performance. And with AI-based power management, the gameplay is not only smooth, but also stable as well. Moreover, by increasing the size of the vapor chamber, the cooling performance is enhanced so that you would feel less heat. Thus, from casual to heavy games, you can experience faster and smoother gaming, and can even play longer. 

Keep in mind that the S23 Series comes with even more intelligent Vision Booster*. Whether you  are playing the game inside or outside , S23 's vision booster adapts to the ambient light to provide brighter  screen during your gameplay.",*Not activated when Eye comfort shield is active.,"Revised : 
That's a wonderful question, <Customer Name>!

The Galaxy S23 Series is definitely the Ultimate Gaming Machine. 

With the fastest 4nm AP in Galaxy ever, the S23 Series provides powerful gaming performance. And with AI-based power management, the gameplay is not only smooth, but also stable as well. Moreover, by increasing the size of the vapor chamber, the cooling performance is enhanced so that you would feel less heat. Thus, from casual to heavy games, you can experience faster and smoother gaming, and can even play longer. 

Keep in mind that the S23 Series comes with even more intelligent Vision Booster*. Whether you  are playing the game inside or outside , S23 's vision booster adapts to the ambient light to provide brighter  screen during your gameplay. 

Disclaimer : 
*Not activated when Eye comfort shield is active."
23,Performance,Fingerprint,How is the Fingerprint scanner better from the previous model (S22 Series)? ,"We are glad to answer your question, <Customer Name>!
The Galaxy S23 Series is equipped with the same ultrasonic fingerprint scanner as the S22 Series.",,"Revised : 
We are glad to answer your question, <Customer Name>!
The Galaxy S23 Series is equipped with the same ultrasonic fingerprint scanner as the S22 Series."
24,Performance,Sound,Are Stereo speakers and Dolby ATMOS supported?,"That's a wonderful question, <Customer Name>! 

You can experience clear, rich, 3D sound enhanced by Dolby Atmos through the device speakers and Type-C earphones.",,"Revised : 
That's a wonderful question, <Customer Name>! 

You can experience clear, rich, 3D sound enhanced by Dolby Atmos through the device speakers and Type-C earphones."
25,Performance,Water and Dust Resistance / IP68,What are the specifications of water and dust resistance?,"Thank you for asking, <Customer Name> !

The Galaxy S23 Series features an IP68 rating, the Galaxy standard for water and dust resistance",※IP68 is based on test conditions for submersion in up to 1.5 meters of freshwater for up to 30 minutes. Not advised for beach or pool use. Water or dust damage not covered by warranty.,"Revised : 
Thank you for asking, <Customer Name> !

The Galaxy S23 Series features an IP68 rating, the Galaxy standard for water and dust resistance 

Disclaimer : 
※IP68 is based on test conditions for submersion in up to 1.5 meters of freshwater for up to 30 minutes. Not advised for beach or pool use. Water or dust damage not covered by warranty."
26,Battery,Capacity,What is the battery capacity of each model?,"Each S23 Series model features a longer-lasting battery.
- -5,000 mAh (S23 Ultra) - -4,700 mAh (S23+) - -3,900 mAh (S23)

The 4nm processor with 3rd party video apps optimization provides low-power consumption to make the S23 Series last longer.  Not to mention, the S23 Series supports Super Fast Charging, Fast Wireless Charging 2.0, and Reverse Wireless Charging.

• (	45W) Super Fast Charging 2.0 (S23 Ultra/S23+)
•	 Super Fast Charging (S23)","※ Usage time tested in an internal laboratory with unused products. Usage time on the official website may vary with other test method, considering the deviation in actual user environment. Actual battery life, charging time, and usage time may vary depending on the network environment, usage patterns, amount of calls and messages, charging frequency, and other factors.
※ Typical value tested under third-party laboratory condition. Rated(minimum) capacity is less.
※ Super Fast Charger required and sold separately. ","Revised : 
Each S23 Series model features a longer-lasting battery.
- -5,000 mAh (S23 Ultra) - -4,700 mAh (S23+) - -3,900 mAh (S23)

The 4nm processor with 3rd party video apps optimization provides low-power consumption to make the S23 Series last longer.  Not to mention, the S23 Series supports Super Fast Charging, Fast Wireless Charging 2.0, and Reverse Wireless Charging.

• (	45W) Super Fast Charging 2.0 (S23 Ultra/S23+)
•	 Super Fast Charging (S23) 

Disclaimer : 
※ Usage time tested in an internal laboratory with unused products. Usage time on the official website may vary with other test method, considering the deviation in actual user environment. Actual battery life, charging time, and usage time may vary depending on the network environment, usage patterns, amount of calls and messages, charging frequency, and other factors.
※ Typical value tested under third-party laboratory condition. Rated(minimum) capacity is less.
※ Super Fast Charger required and sold separately. "
27,Battery,Charging,How fast does the battery charge? ,"The Galaxy S23 Series supports Super-Fast Charging 

•	45W Super-Fast Charging (S23 Ultra/S23+)
•	25W Super-Fast Charging (S23)

You can even charge wirelessly at 15W with Fast Wireless Charging. 
Galaxy S23 Series also supports Reverse Wireless Charging so you can power other galaxy devices",※ Super Fast Charger required and sold separately. ,"Revised : 
The Galaxy S23 Series supports Super-Fast Charging 

•	45W Super-Fast Charging (S23 Ultra/S23+)
•	25W Super-Fast Charging (S23)

You can even charge wirelessly at 15W with Fast Wireless Charging. 
Galaxy S23 Series also supports Reverse Wireless Charging so you can power other galaxy devices 

Disclaimer : 
※ Super Fast Charger required and sold separately. "
28,Battery,Reverse Wireless Charging,Is <Reverse Wireless Charging> supported?,"That's a great question <Customer Name>! 

Yes, all models support Reverse Wireless Charging.
Reverse Wireless Charging is an innovative feature that lets you turn your S23 Series into a wireless charger.

It gives you the power to share your battery and charge your Galaxy Watch or Galaxy Buds or Qi-certified devices. No cables are necessary.","※Limited to Samsung or other brand smartphones with WPC Qi wireless charging, such as Galaxy Note20 Series, S21 Series, Z Fold3, etc. and wearables. If battery power is lower than 30% Reverse Wireless Charging may not function. May not work with certain accessories, cases, or other brand devices. May affect call reception or data services, depending on your network environment. ","Revised : 
That's a great question <Customer Name>! 

Yes, all models support Reverse Wireless Charging.
Reverse Wireless Charging is an innovative feature that lets you turn your S23 Series into a wireless charger.

It gives you the power to share your battery and charge your Galaxy Watch or Galaxy Buds or Qi-certified devices. No cables are necessary. 

Disclaimer : 
※Limited to Samsung or other brand smartphones with WPC Qi wireless charging, such as Galaxy Note20 Series, S21 Series, Z Fold3, etc. and wearables. If battery power is lower than 30% Reverse Wireless Charging may not function. May not work with certain accessories, cases, or other brand devices. May affect call reception or data services, depending on your network environment. "
29,Battery,Charging,Does the S23 Series support 45W charging?," Thank you for asking, <Customer Name>.
    
The S23 Ultra/S23+ supports Super Fast Charging 2.0 (Up to 45W), however the S23 supports Super Fast Charging only. ","* For the S23, 25W Fast Charging supported only.","Revised : 
 Thank you for asking, <Customer Name>.
    
The S23 Ultra/S23+ supports Super Fast Charging 2.0 (Up to 45W), however the S23 supports Super Fast Charging only.  

Disclaimer : 
* For the S23, 25W Fast Charging supported only."
30,Display,Flat / Edge,Does the S23 Series include an Edge or Flat design ?,"That is a great question <Customer Name>! 
The S23 Ultra features a new edge display with a larger flat area and the S23+/S23 feature a flat display.",,"Revised : 
That is a great question <Customer Name>! 
The S23 Ultra features a new edge display with a larger flat area and the S23+/S23 feature a flat display."
31,Display,Size,What is the size and weight of the <Galaxy S23 Series>?,"The new Galaxy S23 Series is available in 3 sizes. 

The S23 Ultra has 6.8"" QHD+ Display and it weights 233g/234g (Sub6/mmWave) 
The S23+ has 6.6"" FHD+ Display, and it weights 195g/196g (Sub6/mmWave)
The S23 has 6.1"" FHD+ Display, and it weights 168g/168g (Sub6/mmWave)","*Screen measured diagonally, as a full rectangle, without accounting for the rounded corners. Actual viewable area may be smaller due to the rounded corners and cameras.","Revised : 
The new Galaxy S23 Series is available in 3 sizes. 

The S23 Ultra has 6.8"" QHD+ Display and it weights 233g/234g (Sub6/mmWave) 
The S23+ has 6.6"" FHD+ Display, and it weights 195g/196g (Sub6/mmWave)
The S23 has 6.1"" FHD+ Display, and it weights 168g/168g (Sub6/mmWave) 

Disclaimer : 
*Screen measured diagonally, as a full rectangle, without accounting for the rounded corners. Actual viewable area may be smaller due to the rounded corners and cameras."
32,Display,Dynamic AMOLED 2X,What is the improvement on the S23 Series Display ?,"""That's a great question <Customer Name> ! 

There are so many great things about the Galaxy S23 Series' display!
The S23 Series has a Dynamic AMOLED 2X display for perfectly watching all your favorite content in various lighting conditions.

All Galaxy S23 models have a peak brightness of 1750 nits, which is the same as the S22 Ultra, but a new feature, Adaptive Vision Booster* provides better outdoor visibility by adjusting the color tone and brightness automatically for various lighting conditions. Also, the new Enhanced comfort mode optimizes a font color, color temperature/gamut, and contrast ratio to relieve your eyestrains at night. 

S23 Series’ display still features a 120Hz Adaptive Refresh Rate to consume less power. 
•	(S23 Ultra: 1-120 Hz)
•	(S23/S23+: 48-120 Hz)

So, overall you can enjoy bright, vivid, and accurate colors, even outdoors, for the ultimate viewing experience.""",*Not activated when Eye comfort shield is active.,"Revised : 
""That's a great question <Customer Name> ! 

There are so many great things about the Galaxy S23 Series' display!
The S23 Series has a Dynamic AMOLED 2X display for perfectly watching all your favorite content in various lighting conditions.

All Galaxy S23 models have a peak brightness of 1750 nits, which is the same as the S22 Ultra, but a new feature, Adaptive Vision Booster* provides better outdoor visibility by adjusting the color tone and brightness automatically for various lighting conditions. Also, the new Enhanced comfort mode optimizes a font color, color temperature/gamut, and contrast ratio to relieve your eyestrains at night. 

S23 Series’ display still features a 120Hz Adaptive Refresh Rate to consume less power. 
•	(S23 Ultra: 1-120 Hz)
•	(S23/S23+: 48-120 Hz)

So, overall you can enjoy bright, vivid, and accurate colors, even outdoors, for the ultimate viewing experience."" 

Disclaimer : 
*Not activated when Eye comfort shield is active."
33,Display,120Hz,Are there any Improvements to the Adaptive Refresh Rate (compared with S22 Series)?,"Like the S22 Series, the S23 Series supports a 120Hz Adaptive Refresh Rate. It automatically adapts from 1Hz to 120Hz based on the content you are viewing for smoother scrolling and viewing with less power consumption.
• (S23 Ultra: 1-120 Hz)
• (S23/S23+: 48-120 Hz)

In addition to that, its display has new features for better outdoor visibility and eye comfort.",,"Revised : 
Like the S22 Series, the S23 Series supports a 120Hz Adaptive Refresh Rate. It automatically adapts from 1Hz to 120Hz based on the content you are viewing for smoother scrolling and viewing with less power consumption.
• (S23 Ultra: 1-120 Hz)
• (S23/S23+: 48-120 Hz)

In addition to that, its display has new features for better outdoor visibility and eye comfort."
34,Display,Brightness,How has the brightness of the display been improved?What is 'Adaptive Vision Booster'? ,"The Galaxy S23 Series' Dynamic AMOLED 2X display boasts ultimate outdoor visibility with a 1200/1750 nits of HDR/peak brightness.

The brightness is the same as the S22 Ultra, however a new Adaptive Vision Booster* provides upgraded visibility by automatically finding the optimal color tone and display brightness in 3 levels based on lighting conditions around you.

So, the S23 Series provides an immersive viewing experience, even under direct sunlight.",*Not activated when Eye comfort shield is active.,"Revised : 
The Galaxy S23 Series' Dynamic AMOLED 2X display boasts ultimate outdoor visibility with a 1200/1750 nits of HDR/peak brightness.

The brightness is the same as the S22 Ultra, however a new Adaptive Vision Booster* provides upgraded visibility by automatically finding the optimal color tone and display brightness in 3 levels based on lighting conditions around you.

So, the S23 Series provides an immersive viewing experience, even under direct sunlight. 

Disclaimer : 
*Not activated when Eye comfort shield is active."
35,Display,Size,What is the screen size?,"The new Galaxy S23 Series is available in 3 sizes. 

- S23 Ultra has 6.8"" QHD+ 
- S23+ has 6.6"" FHD+ 
- S23 has 6.1"" FHD+ 

All 3 models feature an advanced cinematic Infinity-O Display, perfectly designed to show your favorite contents on a large, immersive screen with a minimized punch hole and thinner bezel.",,"Revised : 
The new Galaxy S23 Series is available in 3 sizes. 

- S23 Ultra has 6.8"" QHD+ 
- S23+ has 6.6"" FHD+ 
- S23 has 6.1"" FHD+ 

All 3 models feature an advanced cinematic Infinity-O Display, perfectly designed to show your favorite contents on a large, immersive screen with a minimized punch hole and thinner bezel."
36,S Pen,S Pen,What's new about the S Pen for the S23 Ultra?,"That is a great question indeed, <Customer Name>! 

Like the S22 Ultra, the S23 Ultra is equipped with the S Pen. Advanced Text Extraction feature* is now more intelligent than ever, so you can get various app suggestions by the context of the text extracted from an image or video. And the S Pen to Text feature is also improved to be available for Google apps**. ","* Available to scan the date, time, address, phone number, email, URL
** Google, Chrome, Message, Gmail, Maps, etc.","Revised : 
That is a great question indeed, <Customer Name>! 

Like the S22 Ultra, the S23 Ultra is equipped with the S Pen. Advanced Text Extraction feature* is now more intelligent than ever, so you can get various app suggestions by the context of the text extracted from an image or video. And the S Pen to Text feature is also improved to be available for Google apps**.  

Disclaimer : 
* Available to scan the date, time, address, phone number, email, URL
** Google, Chrome, Message, Gmail, Maps, etc."
37,S Pen,Compatibility,Can I use previous <S Pen> in other Galaxy Series for <S23 Ultra> ?,"That is a great question indeed, <Customer Name>! 

Yes, you can use the previous S Pen on the S23 Ultra.

Basic functions including touch interaction, hovering and writing work on the S23 Ultra.
However, Bluetooth functions like ""Air Actions"" are not available on the S23 Ultra.",,"Revised : 
That is a great question indeed, <Customer Name>! 

Yes, you can use the previous S Pen on the S23 Ultra.

Basic functions including touch interaction, hovering and writing work on the S23 Ultra.
However, Bluetooth functions like ""Air Actions"" are not available on the S23 Ultra."
38,S Pen,Compatibility,Can I use the S23 Ultra's S Pen with other devices ?,"That is a great question indeed, <Customer Name>! 
Yes, basic functions such as touch interaction, hovering and writing work on other devices.",,"Revised : 
That is a great question indeed, <Customer Name>! 
Yes, basic functions such as touch interaction, hovering and writing work on other devices."
39,S Pen,IP68,Does the S23 Ultra’s S Pen support water and dust resistance?    Is it possible to charge and use the S Pen when it is slightly wet?,"The S Pen for the S23 Ultra also support IP68 rating of water resistance. A small amount of water won't cause any issue with charging and usage, but it is recommended that water is removed before using it.",*IP68 is based on test conditions for submersion in up to 1.5 meters of freshwater for up to 30 minutes. Not advised for beach or pool use. Water or dust damage not covered by warranty.,"Revised : 
The S Pen for the S23 Ultra also support IP68 rating of water resistance. A small amount of water won't cause any issue with charging and usage, but it is recommended that water is removed before using it. 

Disclaimer : 
*IP68 is based on test conditions for submersion in up to 1.5 meters of freshwater for up to 30 minutes. Not advised for beach or pool use. Water or dust damage not covered by warranty."
40,S Pen,S Pen,How can the S23 Ultra help me not lose the S Pen?,"That is a great question indeed, <Customer Name>! 

'The device sends a notification if the device is moved when S Pen is not inserted.",,"Revised : 
That is a great question indeed, <Customer Name>! 

'The device sends a notification if the device is moved when S Pen is not inserted."
41,S Pen,Bluetooth,Does the S Pen for the S23 Ultra support more Air Action features than the S22 Ultra?,"That is a great question indeed, <Customer Name>! 

No, it supports the same Air Action features as the S22 Ultra.",,"Revised : 
That is a great question indeed, <Customer Name>! 

No, it supports the same Air Action features as the S22 Ultra."
42,S Pen,Battery,Does the S23 Ultra S Pen have an internal battery? How is it charged and what is the available usage time when fully charged?,"The S Pen for the S23 Ultra comes has a 0.35 mAh of battery and it is automatically charged when inserted into the S23 Ultra. Also, it can be fully charged in 7 mins. It lasts up to 24 hrs on standby, or you can use it continuously for Air Actions for 20 mins when it's fully charged.",,"Revised : 
The S Pen for the S23 Ultra comes has a 0.35 mAh of battery and it is automatically charged when inserted into the S23 Ultra. Also, it can be fully charged in 7 mins. It lasts up to 24 hrs on standby, or you can use it continuously for Air Actions for 20 mins when it's fully charged."
43,Galaxy Ecosystem,Link to Windows,How does <Link to Windows> work?,"Thank you for asking, <Customer Name> 

Galaxy's phone-PC continuity features are more enhanced with Link to Windows for your productivity. 

With Link to Windows, you continuously browse websites from your phone on your PC. Its Audio Streaming features lets you listen to sound either on your phone or PC while controlling the volume on your PC. And your PC can easily go online by directly connecting it to your mobile network with an instant hotspot feature.

Of course, using phone apps on your PC, easy file transferring between your phone and PC, and more powerful features are also still available.","* Availability may vary depending on country or carrier.
* Compatibility and availability of functions and features may vary depending on app.
* To connect your phone to your PC, activate 'Link to Windows"", and use the 'Your Phone' application on your PC. 'Your Phone"" application is preloaded on PCs with Windows 10 October 2018 Update or later, and is downloadable for Windows 10 April 2018 Update or later versions. Requires a Microsoft Account.
","Revised : 
Thank you for asking, <Customer Name> 

Galaxy's phone-PC continuity features are more enhanced with Link to Windows for your productivity. 

With Link to Windows, you continuously browse websites from your phone on your PC. Its Audio Streaming features lets you listen to sound either on your phone or PC while controlling the volume on your PC. And your PC can easily go online by directly connecting it to your mobile network with an instant hotspot feature.

Of course, using phone apps on your PC, easy file transferring between your phone and PC, and more powerful features are also still available. 

Disclaimer : 
* Availability may vary depending on country or carrier.
* Compatibility and availability of functions and features may vary depending on app.
* To connect your phone to your PC, activate 'Link to Windows"", and use the 'Your Phone' application on your PC. 'Your Phone"" application is preloaded on PCs with Windows 10 October 2018 Update or later, and is downloadable for Windows 10 April 2018 Update or later versions. Requires a Microsoft Account.
"
44,Galaxy Ecosystem,App Cast,What is App Cast?,"We are glad you asked, <Customer Name>! 

App Cast is a type of mirroring service. A big difference is that you can still use other apps on your S23 Series while mirroring a specific app to your TV. So, even if you are watching YouTube with your family by mirroring your phone to the TV, you can use other apps, such as running messenger apps, etc., on your phone.","* Supported apps: YouTube, Netflix, Twitch, Google Play Movies & TV, Samsung Internet, Samsung Health and more  (TBD)
* For a device-to-device connection, Wi-Fi Direct connection needed.
","Revised : 
We are glad you asked, <Customer Name>! 

App Cast is a type of mirroring service. A big difference is that you can still use other apps on your S23 Series while mirroring a specific app to your TV. So, even if you are watching YouTube with your family by mirroring your phone to the TV, you can use other apps, such as running messenger apps, etc., on your phone. 

Disclaimer : 
* Supported apps: YouTube, Netflix, Twitch, Google Play Movies & TV, Samsung Internet, Samsung Health and more  (TBD)
* For a device-to-device connection, Wi-Fi Direct connection needed.
"
45,Galaxy Ecosystem,"Samsung
DeX ",How does <Samsung DeX> work with Galaxy S23 Series?,"Thank you for asking, <Customer Name> 

Samsung DeX has been upgraded with a new way to wirelessly set up a second screen that expands on an even bigger display. You can use separate apps on the external display and S23 Series simultaneously. 

You can watch movies on a TV while surfing the Web on the mobile at the same time, or you can take a note with Samsung Notes while watching online lectures on TV.","※Samsung DeX Wireless connection is supported with smart TVs that support Miracast only. Samsung DeX provides optimized experience with Samsung smart TV launched after ’19.
 ※Samsung DeX for PC requires PC app download, and operates on selected devices, Windows 7, 10 and versions of Mac OS higher than 10.13. Certain apps may not run or require separate license (for purchase) on Samsung DeX.
","Revised : 
Thank you for asking, <Customer Name> 

Samsung DeX has been upgraded with a new way to wirelessly set up a second screen that expands on an even bigger display. You can use separate apps on the external display and S23 Series simultaneously. 

You can watch movies on a TV while surfing the Web on the mobile at the same time, or you can take a note with Samsung Notes while watching online lectures on TV. 

Disclaimer : 
※Samsung DeX Wireless connection is supported with smart TVs that support Miracast only. Samsung DeX provides optimized experience with Samsung smart TV launched after ’19.
 ※Samsung DeX for PC requires PC app download, and operates on selected devices, Windows 7, 10 and versions of Mac OS higher than 10.13. Certain apps may not run or require separate license (for purchase) on Samsung DeX.
"
