No,Category,Type,Question,Revised,Disclaimer,Combined_Content
46,Galaxy Ecosystem,Music share,What is <Music Share>? Is the number of devices that can be connected for Music Sharing limited?,"We are glad you asked <Customer Name>! 

Music Share is a new way to spread the tunes around through Galaxy phones and Bluetooth. Instead of having to unpair and repair with your Bluetooth devices, your friends can just connect to your phone to play music. 

It works with compatible Bluetooth headphones, too. 

You are also able to connect to the Bluetooth speaker in your friend’s car by syncing up to their connected Galaxy phone. Your friend doesn't have to unpair their phone from their car in order to make this work!",※Both phones need to have Wi-Fi and Bluetooth turned on while sharing. ,"Revised : 
We are glad you asked <Customer Name>! 

Music Share is a new way to spread the tunes around through Galaxy phones and Bluetooth. Instead of having to unpair and repair with your Bluetooth devices, your friends can just connect to your phone to play music. 

It works with compatible Bluetooth headphones, too. 

You are also able to connect to the Bluetooth speaker in your friend’s car by syncing up to their connected Galaxy phone. Your friend doesn't have to unpair their phone from their car in order to make this work! 

Disclaimer : 
※Both phones need to have Wi-Fi and Bluetooth turned on while sharing. "
47,Galaxy Ecosystem,Motion Mirror,How do you use Motion Mirror?,"We are glad you asked, <Customer Name>! 

* Steps: Tap [Smart View] on the Quick Panel → Select the device to mirror your phone on → Tap [Smart View] → Create a PIP (Picture-in-Picture) screen to mirror the front camera of your phone.

Motion Mirror lets you enjoy Samsung Health, YouTube, and more of your phone content on a TV screen, and you can do things like check your poses and posture in real time with Motion Mirror while working out.

* Tip: If a Galaxy Watch is paired with your phone, you can monitor your workout information, such as a duration, heart rate, calorie consumption, etc. in real time. And your activity information is automatically recorded to Samsung Health.",,"Revised : 
We are glad you asked, <Customer Name>! 

* Steps: Tap [Smart View] on the Quick Panel → Select the device to mirror your phone on → Tap [Smart View] → Create a PIP (Picture-in-Picture) screen to mirror the front camera of your phone.

Motion Mirror lets you enjoy Samsung Health, YouTube, and more of your phone content on a TV screen, and you can do things like check your poses and posture in real time with Motion Mirror while working out.

* Tip: If a Galaxy Watch is paired with your phone, you can monitor your workout information, such as a duration, heart rate, calorie consumption, etc. in real time. And your activity information is automatically recorded to Samsung Health."
48,Accessories,Case,"What are the improvements to the APS lineup, compared to the S22 Series?","We are glad you asked, <Customer Name>! 

We have prepared 3 new cases for the Galaxy S23 Series, ""Clear Gadget"", ""Rugged Gadget"",  and ""Silicone Grip"".
Above all, all the cases received ECOLOGO certification from UL Solutions by applying recycled (PCM, Recycled micro fiber) or bio-based materials.

Try to find a case that will work best for you.",,"Revised : 
We are glad you asked, <Customer Name>! 

We have prepared 3 new cases for the Galaxy S23 Series, ""Clear Gadget"", ""Rugged Gadget"",  and ""Silicone Grip"".
Above all, all the cases received ECOLOGO certification from UL Solutions by applying recycled (PCM, Recycled micro fiber) or bio-based materials.

Try to find a case that will work best for you."
49,Accessories,In-box,Why did Samsung choose to remove wired headphones and in-box chargers for the S23 Series? ,"We discovered that more and more Galaxy users are reusing accessories they already have. Therefore, we are transitioning to the removal of the charger plug and earphones in our latest line of Galaxy smartphones – starting in select countries.

We believe that the gradual removal of the charger plug and earphones from our in-box device packaging can help alleviate pressure that consumers may feel towards continually receiving new chargers and accessories every time they buy a new phone. It is important to note that we have used a standardized charging port (USB-C type) since 2017, making older chargers still compatible with our newest Galaxy devices. We are including the USB-C cable in the box. In addition, we find that 25% of consumers are choosing to charge their device wirelessly. ","*Charger not included; use only Samsung-approved chargers and cables; do not use any worn or damaged chargers or cables; incompatible charger or cable can cause serious injuries or damage to your device.
* S23 Series In-box items: Smartphone, manual and USB-C to USB-C cable
* Due to local government regulations, S23 Series will be sold with a charger plug and/or earphones in the packaging in select markets. ","Revised : 
We discovered that more and more Galaxy users are reusing accessories they already have. Therefore, we are transitioning to the removal of the charger plug and earphones in our latest line of Galaxy smartphones – starting in select countries.

We believe that the gradual removal of the charger plug and earphones from our in-box device packaging can help alleviate pressure that consumers may feel towards continually receiving new chargers and accessories every time they buy a new phone. It is important to note that we have used a standardized charging port (USB-C type) since 2017, making older chargers still compatible with our newest Galaxy devices. We are including the USB-C cable in the box. In addition, we find that 25% of consumers are choosing to charge their device wirelessly.  

Disclaimer : 
*Charger not included; use only Samsung-approved chargers and cables; do not use any worn or damaged chargers or cables; incompatible charger or cable can cause serious injuries or damage to your device.
* S23 Series In-box items: Smartphone, manual and USB-C to USB-C cable
* Due to local government regulations, S23 Series will be sold with a charger plug and/or earphones in the packaging in select markets. "
50,Accessories,In-box,Will Samsung exclude the charger from the smartphone package in the future?,"Samsung is working on the global transition of the removal of the charger plug and earphones from Galaxy smartphones*, starting with S21 Series. The Galaxy S23 Series and other Galaxy smartphones will still include a cable in the packaging to attach the smartphone to the consumer’s existing charger plug. ",* Exception models may exist.,"Revised : 
Samsung is working on the global transition of the removal of the charger plug and earphones from Galaxy smartphones*, starting with S21 Series. The Galaxy S23 Series and other Galaxy smartphones will still include a cable in the packaging to attach the smartphone to the consumer’s existing charger plug.  

Disclaimer : 
* Exception models may exist."
51,Accessories,Case,What kind of dedicated cases are available for <Galaxy S23 Series> ? ,"We have a variety of phone cases in different style and colors. Each one is designed to match your lifestyle.

Not only that,  we put our eco-conscious efforts not only toward the device, but also the S23-exclusive cases. All the cases received ECOLOGO certification from UL Solutions by applying recycled (PCM, Recycled micro fiber) or bio-based materials.

Total of 8 types of cases have been prepared for the S23 Series, and ""Clear/Rugged Gadget Case"" and ""Silicone Grip Case"" are the new types of case that comes with the Series.

- The ""Clear Gadget"" and ""Rugged Gadget"" are customizable with a grip/strap/stand to match your tastes. 
- And ""Smart View Wallet Case"" provides information, such as the time or notifications, without opening the cover. 
- ""Silicone Grip Case"" is customizable by changing the strap on the back. 
- The ""Leather Case"" and ""Silicone Case"" are designed to highlight the slimmer look of the S23 Series.
- Also, the ""Frame Case"" and ""Clear Case"" emphasize its own premium design with a more natural look and feel.

Have a closer look, and let's try it out. ",*Accessories sold separately. Model and color availability may vary by country or carrier.,"Revised : 
We have a variety of phone cases in different style and colors. Each one is designed to match your lifestyle.

Not only that,  we put our eco-conscious efforts not only toward the device, but also the S23-exclusive cases. All the cases received ECOLOGO certification from UL Solutions by applying recycled (PCM, Recycled micro fiber) or bio-based materials.

Total of 8 types of cases have been prepared for the S23 Series, and ""Clear/Rugged Gadget Case"" and ""Silicone Grip Case"" are the new types of case that comes with the Series.

- The ""Clear Gadget"" and ""Rugged Gadget"" are customizable with a grip/strap/stand to match your tastes. 
- And ""Smart View Wallet Case"" provides information, such as the time or notifications, without opening the cover. 
- ""Silicone Grip Case"" is customizable by changing the strap on the back. 
- The ""Leather Case"" and ""Silicone Case"" are designed to highlight the slimmer look of the S23 Series.
- Also, the ""Frame Case"" and ""Clear Case"" emphasize its own premium design with a more natural look and feel.

Have a closer look, and let's try it out.  

Disclaimer : 
*Accessories sold separately. Model and color availability may vary by country or carrier."
52,Service,Samsung Pay,Why are you no longer supporting non-NFC merchants? ,"NFC is becoming more widely accepted and expected by consumers and businesses. 
Currently 90%*of merchant locations, where Samsung Pay users shop at, have NFC terminals.
Samsung Pay will focus its support on NFC transactions, across the Galaxy portfolio.
We will continue to support MST on previous, compatible devices. 
* The percentage can be different by countries. ",* The percentage can be different by countries. ,"Revised : 
NFC is becoming more widely accepted and expected by consumers and businesses. 
Currently 90%*of merchant locations, where Samsung Pay users shop at, have NFC terminals.
Samsung Pay will focus its support on NFC transactions, across the Galaxy portfolio.
We will continue to support MST on previous, compatible devices. 
* The percentage can be different by countries.  

Disclaimer : 
* The percentage can be different by countries. "
53,Service,Pre-order Benefits,Are there any benefits for customers who purchase S23 Series during the pre-order period?,"If you pre-order S23 Series now, you would get a free storage upgrade as follows:

128GB -> 256GB: S23
256GB -> 512GB: S23/S23+/S23 Ultra

With more storage, you can take high-resolution photos and videos, and store a whole season of your favorite shows.
We also provide additional pre-order benefits which is <promotion>*. ","*Additional pre-order benefit varies by region. It can be in the form of Enhanced Trade-in, Eco Bundle, or E-voucher. ","Revised : 
If you pre-order S23 Series now, you would get a free storage upgrade as follows:

128GB -> 256GB: S23
256GB -> 512GB: S23/S23+/S23 Ultra

With more storage, you can take high-resolution photos and videos, and store a whole season of your favorite shows.
We also provide additional pre-order benefits which is <promotion>*.  

Disclaimer : 
*Additional pre-order benefit varies by region. It can be in the form of Enhanced Trade-in, Eco Bundle, or E-voucher. "
